{
  "$schema": "https://json-schema.org/draft/2020-12/schema",
  "$id": "https://optees.org/schemas/simulator/v2/transition.v2.json",
  "title": "DeferredTransitionRecord",
  "description": "Immutable record of state changes, resource deltas, and incurred costs applied to a policy virtual account for deferred paper settlement.",
  "type": "object",
  "required": [
    "$type",
    "schema_version",
    "transition_id",
    "round_id",
    "policy_id",
    "settlement_outcome_id",
    "economic_fill_time",
    "effective_time",
    "resource_deltas",
    "costs",
    "total_cost_reference_unit",
    "account_state_before_hash",
    "account_state_after_hash"
  ],
  "additionalProperties": false,
  "properties": {
    "$type": {
      "type": "string",
      "const": "transition"
    },
    "schema_version": {
      "type": "string",
      "const": "2.0.0"
    },
    "transition_id": {
      "type": "string",
      "pattern": "^trn_[a-zA-Z0-9_-]+$"
    },
    "round_id": {
      "type": "string",
      "pattern": "^rnd_[a-zA-Z0-9_-]+$"
    },
    "policy_id": {
      "type": "string",
      "pattern": "^pol-def_[a-zA-Z0-9_-]+$"
    },
    "settlement_outcome_id": {
      "type": "string",
      "pattern": "^set-out_[a-zA-Z0-9_-]+$"
    },
    "economic_fill_time": {
      "type": "string",
      "pattern": "^\\d{4}-\\d{2}-\\d{2}T\\d{2}:\\d{2}:\\d{2}(\\.\\d+)?Z$"
    },
    "effective_time": {
      "type": "string",
      "pattern": "^\\d{4}-\\d{2}-\\d{2}T\\d{2}:\\d{2}:\\d{2}(\\.\\d+)?Z$"
    },
    "resource_deltas": {
      "type": "array",
      "minItems": 1,
      "items": {
        "type": "object",
        "required": [
          "resource_id",
          "delta_quantity",
          "valuation_price"
        ],
        "additionalProperties": false,
        "properties": {
          "resource_id": {
            "type": "string",
            "minLength": 1
          },
          "delta_quantity": {
            "type": "string",
            "pattern": "^-?\\d+(\\.\\d+)?$"
          },
          "valuation_price": {
            "type": "string",
            "pattern": "^\\d+(\\.\\d+)?$"
          }
        }
      }
    },
    "costs": {
      "type": "array",
      "items": {
        "type": "object",
        "required": [
          "cost_type",
          "resource_id",
          "amount"
        ],
        "additionalProperties": false,
        "properties": {
          "cost_type": {
            "type": "string",
            "enum": [
              "TRANSACTION_FEE",
              "HOLDING_COST",
              "PENALTY",
              "BORROWING_FEE"
            ]
          },
          "resource_id": {
            "type": "string",
            "minLength": 1
          },
          "amount": {
            "type": "string",
            "pattern": "^\\d+(\\.\\d+)?$"
          }
        }
      }
    },
    "total_cost_reference_unit": {
      "type": "string",
      "pattern": "^\\d+(\\.\\d+)?$"
    },
    "account_state_before_hash": {
      "type": "string",
      "pattern": "^sha256:[a-f0-9]{64}$"
    },
    "account_state_after_hash": {
      "type": "string",
      "pattern": "^sha256:[a-f0-9]{64}$"
    }
  }
}
